property_address,listing_link,bedrooms,bathroms,square_footage,price,listing_description,contact_name,contact_email,contact_phone_number,images
"Room in West New York, New Jersey, United States",https://www.airbnb.com/rooms/717229646853340253?adults=1&category_tag=Tag%3A8678&children=0&enable_m3_private_room=true&infants=0&pets=0&photo_id=1624565977&search_mode=regular_search&check_in=2024-08-04&check_out=2024-08-08&source_impression_id=p3_1722594442_P3w8nZ_JEmFuYxC2&previous_page_section_name=1000&federated_search_id=93438639-1222-42e1-ab3f-7b14bcb56819,1,1,NA,"5,","Start the day with a stroll along JFK Blvd East for an amazing panoramic view of New York City to the NYC express bus stop or pick up a morning treat from Las Chicas Bakery & Cafe. Enjoy a private room with an NYC view of this bright, airy historic 1900s home with a minimal, modern style.During your stayYour host will be on the property and will be available for anything you need during your stay.",NA,NA,NA,"['https://a0.muscache.com/im/pictures/miso/Hosting-717229646853340253/original/204f3bd7-17bb-4537-8258-ef1804538ed7.jpeg?im_w=720', 'https://a0.muscache.com/im/pictures/miso/Hosting-717229646853340253/original/aa89257f-f38c-4981-b788-a643e2f7a16d.jpeg?im_w=720', 'https://a0.muscache.com/im/pictures/miso/Hosting-717229646853340253/original/8f17721c-3407-4dd5-8b8f-1e0cb670cd08.jpeg?im_w=720', 'https://a0.muscache.com/im/pictures/miso/Hosting-717229646853340253/original/71306f1c-7e21-4637-b287-e64d47c8ec0b.jpeg?im_w=720', 'https://a0.muscache.com/im/pictures/miso/Hosting-717229646853340253/original/d895ac56-993e-4d29-86ec-e2614486dc59.jpeg?im_w=720', 'https://a0.muscache.com/im/pictures/miso/Hosting-717229646853340253/original/7307a903-24bc-46c2-a057-6a3b13819ab7.jpeg?im_w=720', 'https://a0.muscache.com/im/pictures/miso/Hosting-717229646853340253/original/ca03af17-bfdf-49f8-b1c8-6e70c1108b22.jpeg?im_w=720', 'https://a0.muscache.com/im/pictures/miso/Hosting-717229646853340253/original/4b31b562-9897-4270-a5ed-1306eb774d7c.jpeg?im_w=720', 'https://a0.muscache.com/im/pictures/miso/Hosting-717229646853340253/original/2add1338-9f3d-4c94-b55b-380ee2ad5f38.jpeg?im_w=720', 'https://a0.muscache.com/im/pictures/miso/Hosting-717229646853340253/original/425345e2-dc08-4640-bcc8-a494f4b8b471.jpeg?im_w=720', 'https://a0.muscache.com/im/pictures/miso/Hosting-717229646853340253/original/c744fa5c-5458-4c9c-abfa-3269841d8829.jpeg?im_w=720', 'https://a0.muscache.com/im/pictures/miso/Hosting-717229646853340253/original/59e4e9d9-a4bb-4b65-b4b4-f55614f26202.jpeg?im_w=720', 'https://a0.muscache.com/im/pictures/miso/Hosting-717229646853340253/original/eaca097e-ac66-4336-8338-5f63d8116e56.jpeg?im_w=720', 'https://a0.muscache.com/im/pictures/miso/Hosting-717229646853340253/original/621800ae-8ac9-4851-b20b-0424ad167827.jpeg?im_w=720']"
"Room in New York, United States",https://www.airbnb.com/rooms/954215732943587985?adults=1&category_tag=Tag%3A8678&children=0&enable_m3_private_room=true&infants=0&pets=0&photo_id=1871128283&search_mode=regular_search&check_in=2024-08-04&check_out=2024-08-08&source_impression_id=p3_1722594442_P3JORSN4Aq5Hzpw3&previous_page_section_name=1000&federated_search_id=93438639-1222-42e1-ab3f-7b14bcb56819,1,1,NA,"8,",Keep it simple at this peaceful and centrally-located place.Registration numberOSE-STRREG-0005831,NA,NA,NA,"['https://a0.muscache.com/im/pictures/hosting/Hosting-U3RheVN1cHBseUxpc3Rpbmc6OTU0MjE1NzMyOTQzNTg3OTg1/original/8c280eed-cf84-41bc-b7ee-4d23d22d1ab3.png?im_w=720', 'https://a0.muscache.com/im/pictures/hosting/Hosting-U3RheVN1cHBseUxpc3Rpbmc6OTU0MjE1NzMyOTQzNTg3OTg1/original/39ac614f-2010-4d09-b107-9ea8babcf628.png?im_w=720', 'https://a0.muscache.com/im/pictures/hosting/Hosting-U3RheVN1cHBseUxpc3Rpbmc6OTU0MjE1NzMyOTQzNTg3OTg1/original/d197661e-8926-4682-9dc8-e82505b129e4.jpeg?im_w=720', 'https://a0.muscache.com/im/pictures/hosting/Hosting-U3RheVN1cHBseUxpc3Rpbmc6OTU0MjE1NzMyOTQzNTg3OTg1/original/82366932-662d-431f-83e8-7498ca7ec2ab.jpeg?im_w=720', 'https://a0.muscache.com/im/pictures/hosting/Hosting-U3RheVN1cHBseUxpc3Rpbmc6OTU0MjE1NzMyOTQzNTg3OTg1/original/a7c3c12e-e43d-42cd-a3dc-6d68f87ef052.jpeg?im_w=720', 'https://a0.muscache.com/im/pictures/hosting/Hosting-U3RheVN1cHBseUxpc3Rpbmc6OTU0MjE1NzMyOTQzNTg3OTg1/original/462696e6-05ef-4d58-828f-1a8d6d20cc07.jpeg?im_w=720', 'https://a0.muscache.com/im/pictures/miso/Hosting-954215732943587985/original/1285eaac-8690-45c1-9f4d-549b24cf12eb.jpeg?im_w=720', 'https://a0.muscache.com/im/pictures/miso/Hosting-954215732943587985/original/ddd79e46-879d-439a-b947-665602d995b2.jpeg?im_w=720', 'https://a0.muscache.com/im/pictures/miso/Hosting-954215732943587985/original/3f360249-c6c3-41b2-bcd8-50f03ab7cda7.jpeg?im_w=720', 'https://a0.muscache.com/im/pictures/miso/Hosting-954215732943587985/original/3078c7e5-ecb2-4c87-b1fd-aba506626bd5.jpeg?im_w=720']"
"Room in Brooklyn, New York, United States",https://www.airbnb.com/rooms/1004933046061134895?adults=1&category_tag=Tag%3A8678&children=0&enable_m3_private_room=true&infants=0&pets=0&photo_id=1870263436&search_mode=regular_search&check_in=2024-08-06&check_out=2024-08-09&source_impression_id=p3_1722594442_P3JsuWk6nwsd9pTA&previous_page_section_name=1000&federated_search_id=93438639-1222-42e1-ab3f-7b14bcb56819,1,1,NA,"6,","This is a comfy, Mexican-style bedroom in my apartment, which is on a quiet block in the trend-setting neighborhood of Bushwick. The room features a top-of-the-line American Leather sofa bed, so during the day you can turn the room into a professional looking office for reading and Zoom meetings—or just to give yourself more space. Plus you have a door to the lovely garden. I will be in residence throughout your stay to answer any questions and to help facilitate a wonderful time in New York.The spaceMy apartment is on the first floor--no stairs to climb! And you'll have your own bathroom! In addition, you'll have access to a colorful and peaceful garden. I work from home, and can attest that this is a quiet building to focus on work during the day—or whatever your schedule is. The building is close to three different subway lines: the A/C, J/Z, and L. Plus there are several fun restaurants and bars nearby, plus all the classic Brooklyn amenities (pizza!).Guest accessYour bedroom is one of two in my comfy first-floor apartment. It is largely self-contained, with a top-of-the-line American Leather sofa bed, television, small refrigerator, work desk, and a private bathroom with a shower stall. In addition, you have access to private gardens in both the front and the back of the building. If you would like to use the kitchen, please coordinate with me. The entrance to the apartment is through the front door of the building, and then a locked door on the first floor of the building. You will pass through the living room and then your bedroom is down the hall.During your stayI work from home and am around most of the day, either working in the garden, cooking, or writing at my desk. I will be in residence throughout your stay. Feel free to call, text, or just knock on my door!Other things to noteThe apartment is also home to two very friendly cats. While they are kept out of the Airbnb room, if you have allergies this room is not a match for you.Registration numberOSE-STRREG-0001170",NA,NA,NA,"['https://a0.muscache.com/im/pictures/hosting/Hosting-U3RheVN1cHBseUxpc3Rpbmc6MTAwNDkzMzA0NjA2MTEzNDg5NQ%3D%3D/original/adbed9e9-ea3d-4993-accf-bc3eb1046b1e.jpeg?im_w=720', 'https://a0.muscache.com/im/pictures/hosting/Hosting-U3RheVN1cHBseUxpc3Rpbmc6MTAwNDkzMzA0NjA2MTEzNDg5NQ%3D%3D/original/fff74a65-971f-4642-9bb0-3169eace9e6c.jpeg?im_w=720', 'https://a0.muscache.com/im/pictures/hosting/Hosting-U3RheVN1cHBseUxpc3Rpbmc6MTAwNDkzMzA0NjA2MTEzNDg5NQ%3D%3D/original/87c5de22-6e1c-4476-96db-2f35fa75b970.jpeg?im_w=720', 'https://a0.muscache.com/im/pictures/hosting/Hosting-U3RheVN1cHBseUxpc3Rpbmc6MTAwNDkzMzA0NjA2MTEzNDg5NQ%3D%3D/original/695eded1-25f6-4bd3-8f5b-77835813ffd4.jpeg?im_w=720', 'https://a0.muscache.com/im/pictures/hosting/Hosting-U3RheVN1cHBseUxpc3Rpbmc6MTAwNDkzMzA0NjA2MTEzNDg5NQ%3D%3D/original/a94ff331-ae9a-45bf-9840-c8389dae1717.jpeg?im_w=720', 'https://a0.muscache.com/im/pictures/miso/Hosting-1004933046061134895/original/e2368a6f-e180-447f-bced-a7bfea6f4528.jpeg?im_w=720', 'https://a0.muscache.com/im/pictures/miso/Hosting-1004933046061134895/original/a2f6bdc5-ab10-4369-a282-97eaa321a015.jpeg?im_w=720', 'https://a0.muscache.com/im/pictures/hosting/Hosting-U3RheVN1cHBseUxpc3Rpbmc6MTAwNDkzMzA0NjA2MTEzNDg5NQ%3D%3D/original/8b7fce0e-40dc-441b-a455-6d0ec2d522cc.jpeg?im_w=720']"
"Private room in serviced apartment in Jersey City, New Jersey, United States",https://www.airbnb.com/rooms/12248292?adults=1&children=0&enable_m3_private_room=true&infants=0&pets=0&search_mode=regular_search&check_in=2024-08-06&check_out=2024-08-10&source_impression_id=p3_1722594442_P3I6QvvuUH_GsYJy&previous_page_section_name=1000&federated_search_id=93438639-1222-42e1-ab3f-7b14bcb56819,1,1,NA,"7,","A hotel-like experience featuring a Private bedroom and bathroom with EVERYTHING you need! Catered to tourists and those commuting for work to NYC/Hudson County area. Located in a luxury building with doorman and security, overlooking the Hudson River and NYC skyline. Convenient 10 minute direct commute to Midtown Manhattan. Accommodations include use of a professional workspace with wifi and electrical outlets, available upon request.The spaceProviding a clean, safe, and spacious private room with a queen sized bed, full closet, flat screen TV, and high speed wifi internet. Private, clean bathroom with basic toiletries (shampoo, conditioner, antibacterial hand soap, body wash, etc.). Both are modern and newly renovated.Guest accessAccommodations include exclusive use of the bedroom and bathroom, with access to balcony and use of the kitchen area and appliances.Other things to noteRoom is ideal for tourists or business professionals commuting to NYC, or Jersey City/Hoboken area, who want a clean, safe place to stay. I provide a hotel-like experience.",NA,NA,NA,"['https://a0.muscache.com/im/pictures/f30e6183-47fa-4976-abe6-58d9bf48459a.jpg?im_w=720', 'https://a0.muscache.com/im/pictures/863163ca-102b-4a26-83cf-3ee45c32c6ee.jpg?im_w=720', 'https://a0.muscache.com/im/pictures/d34ffe3d-2742-4da5-8c22-e1959078a805.jpg?im_w=720', 'https://a0.muscache.com/im/pictures/a2d94211-926e-4293-8c8f-b8ec5a7c947c.jpg?im_w=720', 'https://a0.muscache.com/im/pictures/113ae379-c203-4a5d-8d0b-7d8949971ed7.jpg?im_w=720', 'https://a0.muscache.com/im/pictures/6899ce2c-394c-4623-a3a6-2111925dce7b.jpg?im_w=720', 'https://a0.muscache.com/im/pictures/8ba33514-204f-4583-8fd0-15ae474e8e9b.jpg?im_w=720', 'https://a0.muscache.com/im/pictures/cef2cc9f-900b-49c3-a3dc-9576041bbf99.jpg?im_w=720', 'https://a0.muscache.com/im/pictures/86c635d1-f114-48dc-a9d4-b1daba141e87.jpg?im_w=720', 'https://a0.muscache.com/im/pictures/a90b0db9-b6e2-4cf2-9278-14ea55b18d43.jpg?im_w=720', 'https://a0.muscache.com/im/pictures/5726a784-1f8d-4cc4-af5b-381327d432f1.jpg?im_w=720', 'https://a0.muscache.com/im/pictures/d40e89c2-83b2-4559-b336-8e71f775c6a3.jpg?im_w=720', 'https://a0.muscache.com/im/pictures/b6178995-788d-4a43-a7b3-a0ac7b7342b0.jpg?im_w=720']"
"Room in Brooklyn, New York, United States",https://www.airbnb.com/rooms/1142715929556950252?adults=1&category_tag=Tag%3A8678&children=0&enable_m3_private_room=true&infants=0&pets=0&photo_id=1893315921&search_mode=regular_search&check_in=2024-08-05&check_out=2024-08-10&source_impression_id=p3_1722594442_P3ARl1OdtNtMxRYZ&previous_page_section_name=1000&federated_search_id=93438639-1222-42e1-ab3f-7b14bcb56819,1,1,NA,"8,","Simple, clean, and quiet room, walking distance from a park and great restaurants. Centrally located and close to subway stations and bus stops, transportation is a breeze! Queen sized bed comfortably sleeps 2. Free washer and free dryer in unit. 5 minute walk to the Halsey Street J train. Private work desk with chair in your room. Closet with shelf for your clothes.The spaceThis is a shared space. You are renting a room, not the entire apartment. Accommodations include private queen sized bedroom with closet, shared bathroom with amenities, kitchen, living room, dining table, and high speed WIFI.Other things to notePlease be a personally responsible guest! There is a cleaning lady who comes once a week but you are expected to clean up after yourself in the meantime.*Just a Reminder* This is a shared space so you will be sharing the kitchen, living space, and the bathroom with others. If you have another person with you, please make sure to update the reservation to two. We kindly ask that you do not have any guests outside the reservation in the apartment at anytime.Registration numberOSE-STRREG-3040293",NA,NA,NA,"['https://a0.muscache.com/im/pictures/miso/Hosting-1142715929556950252/original/20bbaece-9826-4579-ad9b-9c3b78349068.jpeg?im_w=720', 'https://a0.muscache.com/im/pictures/miso/Hosting-1142715929556950252/original/b24051a5-31ed-490b-807e-1812d6491673.jpeg?im_w=720', 'https://a0.muscache.com/im/pictures/miso/Hosting-1142715929556950252/original/9190ea76-8712-41a9-aa98-ef91c60dec4a.jpeg?im_w=720', 'https://a0.muscache.com/im/pictures/miso/Hosting-1142715929556950252/original/cc5b9aa3-403e-4447-984d-992a76cad2a8.jpeg?im_w=720', 'https://a0.muscache.com/im/pictures/miso/Hosting-1142715929556950252/original/fdaca432-378a-4991-9257-6e85459f62d9.jpeg?im_w=720', 'https://a0.muscache.com/im/pictures/hosting/Hosting-U3RheVN1cHBseUxpc3Rpbmc6MTE0MjcxNTkyOTU1Njk1MDI1Mg%3D%3D/original/7305290d-10e1-43ad-bc3d-fc1154a4965a.jpeg?im_w=720', 'https://a0.muscache.com/im/pictures/miso/Hosting-1142715929556950252/original/5c8374c3-374a-41d1-aff4-8a3ec9525ba5.jpeg?im_w=720', 'https://a0.muscache.com/im/pictures/miso/Hosting-1142715929556950252/original/b216d895-067d-46d0-9029-2a5e03639ae3.jpeg?im_w=720']"
"Room in Brooklyn, New York, United States",https://www.airbnb.com/rooms/14340142?adults=1&category_tag=Tag%3A8678&children=0&enable_m3_private_room=true&infants=0&pets=0&photo_id=203012464&search_mode=regular_search&check_in=2024-08-05&check_out=2024-08-10&source_impression_id=p3_1722594442_P31mXTvJLyOF6YpU&previous_page_section_name=1000&federated_search_id=93438639-1222-42e1-ab3f-7b14bcb56819,1,1,NA,"14,","Sunny Private BedroomModern Private BathroomAuthentic Brooklyn VibeHistoric NYC Neighborhood, Bed-Stuy Brooklyn!Fully Renovated 1890s BrownstoneDeck/BackyardComplimentary Tea or Freshly Ground CoffeeComplimentary Luggage Storage Before Check In or After Check Out24-Hour Check-InHigh Speed WiFiEnglish + EspañolPet-free HomeNo big screen TV 7min walk to J/Z Train7min walk to Bushwick8min subway ride to Williamsburg16min subway ride to Lower ManhattanStreet ParkingThe spaceWe live in a beautiful, fully renovated brownstone in a friendly tree-lined block in Bed-Stuy Brooklyn. We are located near the Bed-Stuy/Bushwick border, giving us access to two unique and diverse Brooklyn neighborhoods. Our home is walking distance from an eclectic mix of new cafes, restaurants, bars and bodegas that have sprung up in both neighborhoods.We occupy the lower duplex of the brownstone and we rent out a single room in our home. You will have a cozy fully furnished private bedroom, steps away, from your very own fully renovated private bathroom. The rental room is bright with large windows that face the backyard. The guest room also has a closet with hangers and a top-of-the line Simmons Beauty Rest Queen mattress. The private full bathroom is equipped with a shower and a tub; a shared half bathroom is also available on the second level of the duplex. Guests will also have access to the living room, dining room, deck and backyard area on the upper level of the duplex. The kitchen is available. Complimentary Tea or Freshly Ground Coffee is available throughout the day. All common spaces are shared with the hosts; including a Ping Pong table at the basement level. Guests can enjoy high speed wireless Internet, central A/C and central heating in both duplex floors. Also, free parking is available on the street, around the perimeter of our house, no meter required, just observe parking rules.WI-FIDownload Speed: 300 MBUpload Speed: 45 MBGuest accessCarlos and I work from home, so one of us, if not both, will be to greeting you when you arrive. You will have access to the house from the street/ground level, where the bedrooms are located. There is a flight of stairs to the social area where the kitchen, dining and living rooms are located.Also, if needed, we are happy to store your luggage at no cost for a few hours before you check in, or a few hours after you check out, giving you some room for more sightseeing.During your stayWe love meeting people and we will be happy to assist you with recommendations regarding your stay in New York. Carlos and I speak fluent English and Spanish.Other things to noteI have been in NYC for over 9 years. I lived in Manhattan for most of those years, and as of 2015, I have been happy to call Brooklyn my new home.Registration numberOSE-STRREG-0001500",NA,NA,NA,"['https://a0.muscache.com/im/pictures/5d9ccef0-4bd1-4c22-b603-eb6dcc8053b4.jpg?im_w=720', 'https://a0.muscache.com/im/pictures/8858316f-5dbc-44ba-b27a-566a7c50804d.jpg?im_w=720', 'https://a0.muscache.com/im/pictures/b9a53108-65e0-4058-bd8e-b37ae881d787.jpg?im_w=720', 'https://a0.muscache.com/im/pictures/f0524c17-b4cb-4f1b-8f6c-3e029fb2caeb.jpg?im_w=720', 'https://a0.muscache.com/im/pictures/43085e17-0668-47b6-9af7-de24811244cc.jpg?im_w=720', 'https://a0.muscache.com/im/pictures/1c4398e1-ed54-4e0b-82df-9dceb264e8eb.jpg?im_w=720', 'https://a0.muscache.com/im/pictures/ba529847-89a4-4b9a-8546-dd6abb65f2af.jpg?im_w=720', 'https://a0.muscache.com/im/pictures/0f074843-73ed-41ff-940d-f9b281122480.jpg?im_w=720', 'https://a0.muscache.com/im/pictures/140aa0f7-948a-4e89-a47a-7455e57df9ef.jpg?im_w=720', 'https://a0.muscache.com/im/pictures/9d8841b6-def3-45c0-82f8-27cbd5d1c776.jpg?im_w=720', 'https://a0.muscache.com/im/pictures/332a75f9-464e-4072-8cc4-10e4ab843a50.jpg?im_w=720', 'https://a0.muscache.com/im/pictures/487b2efd-a50b-46f0-9a16-3af4a84260bc.jpg?im_w=720', 'https://a0.muscache.com/im/pictures/abb1c261-db02-4d0f-99a5-aec6df9442f2.jpg?im_w=720', 'https://a0.muscache.com/im/pictures/6537cd9f-b9b9-4632-9122-2548fd776aa6.jpg?im_w=720', 'https://a0.muscache.com/im/pictures/23dc050a-fa9e-44ae-8267-b08c74019365.jpg?im_w=720', 'https://a0.muscache.com/im/pictures/ed7b6c39-af60-4444-902e-f7234f7b6818.jpg?im_w=720', 'https://a0.muscache.com/im/pictures/65b93600-2c5d-4a6f-ace9-9edddc57e4fa.jpg?im_w=720', 'https://a0.muscache.com/im/pictures/652124e8-11cf-482d-95c4-bb0124a94496.jpg?im_w=720', 'https://a0.muscache.com/im/pictures/6d131e88-bedc-4632-9448-367b9739ad74.jpg?im_w=720', 'https://a0.muscache.com/im/pictures/d6dbd75b-f6ec-42b3-a311-24ba713e3b6e.jpg?im_w=720', 'https://a0.muscache.com/im/pictures/1b5982e9-e3c1-45b2-903b-04a1ff026878.jpg?im_w=720', 'https://a0.muscache.com/im/pictures/ff045b42-0eea-4a70-903e-bbd0d038201d.jpg?im_w=720', 'https://a0.muscache.com/im/pictures/52851bf8-8d59-4509-a47b-0597c7f0fbe6.jpg?im_w=720', 'https://a0.muscache.com/im/pictures/65f40119-0ba8-46ec-add2-337c0d3a1e8a.jpg?im_w=720', 'https://a0.muscache.com/im/pictures/02d6e6be-4f28-43f7-8935-9790df525e61.jpg?im_w=720', 'https://a0.muscache.com/im/pictures/79c05475-a4f8-4436-80b0-2275b5bea621.jpg?im_w=720', 'https://a0.muscache.com/im/pictures/a380a8a2-7691-4d86-b017-979bc88513c1.jpg?im_w=720', 'https://a0.muscache.com/im/pictures/f0c4826e-8704-4e8b-9d3a-965da46fa82d.jpg?im_w=720', 'https://a0.muscache.com/im/pictures/5b0b2d65-1741-4d4a-b2a3-329086a91d19.jpg?im_w=720', 'https://a0.muscache.com/im/pictures/1629dc07-8b5a-4855-8ea2-9028b334dce5.jpg?im_w=720']"
"Room in Weehawken, New Jersey, United States",https://www.airbnb.com/rooms/952365838707694101?category_tag=Tag%3A8678&enable_m3_private_room=true&photo_id=1714202653&search_mode=regular_search&check_in=2024-08-05&check_out=2024-08-08&source_impression_id=p3_1722594441_P3yMFXfPnrgAlodn&previous_page_section_name=1000&federated_search_id=93438639-1222-42e1-ab3f-7b14bcb56819,1,1,NA,"5,","Escape the hustle and bustle of city life in this charming unit located in a safe & peaceful neighborhood in Weehawken with views of Manhattan from the street. This unit is a 15 to 20-minute bus ride to Midtown Manhattan.The spaceThis bedroom is located in a 3-bedroom, 1-bathroom first floor unit with lots of natural sunlight. The kitchen and bathroom are shared with up to 4 other guests depending on bookings of the other rooms.Guest accessYou will have private access to the bedroom and shared access to the kitchen and bathroom. No access to the backyard included in the stay.During your stayI will be available to answer any questions throughout your stay as well as provide any food recommendations either nearby or in Manhattan!Other things to note***Transportation to and from Manhattan***The unit is about a 4-minute walk away from the bus stop. The bus ride is 10-20 minutes to Port Authority Bus Terminal in Manhattan depending on traffic. Normally it takes me around 20 minutes on the bus heading from here to Manhattan and at night it's only a 10-minute bus ride back because there's usually no traffic at night.There is another bus stop that is about a 7-minute walk away with 20 different buses that all take you directly to Port Authority Bus Terminal without stopping. You usually don't have to wait long for a bus to come by at that bus stop.From Port Authority Bus Terminal, you'll have access to various subway lines to take you around the city.",NA,NA,NA,"['https://a0.muscache.com/im/pictures/790e0b0e-032a-46fa-913d-abaf0b881985.jpg?im_w=720', 'https://a0.muscache.com/im/pictures/hosting/Hosting-952365838707694101/original/c2f3a94f-c31b-4f6c-b392-9103a12b90a3.jpeg?im_w=720', 'https://a0.muscache.com/im/pictures/hosting/Hosting-952365838707694101/original/a49ddc3a-6f90-4f9c-be3b-d425e301e190.jpeg?im_w=720', 'https://a0.muscache.com/im/pictures/hosting/Hosting-952365838707694101/original/690b3634-78ab-4880-8bbd-24a32f4047d4.jpeg?im_w=720', 'https://a0.muscache.com/im/pictures/hosting/Hosting-952365838707694101/original/9cbb6e33-09ee-4cc7-a944-4d6e7d9954d7.jpeg?im_w=720', 'https://a0.muscache.com/im/pictures/hosting/Hosting-952365838707694101/original/824d078c-b4ba-4371-8534-75a37864fd4c.jpeg?im_w=720', 'https://a0.muscache.com/im/pictures/hosting/Hosting-952365838707694101/original/e62b5039-3f5f-4164-9770-6db594508183.jpeg?im_w=720']"
"Room in New York, United States",https://www.airbnb.com/rooms/1122575256700615814?category_tag=Tag%3A8678&enable_m3_private_room=true&photo_id=1880128873&search_mode=regular_search&check_in=2024-08-05&check_out=2024-08-08&source_impression_id=p3_1722594441_P3lOvw1DeIV9yXeF&previous_page_section_name=1000&federated_search_id=93438639-1222-42e1-ab3f-7b14bcb56819,1,1,NA,"9,","Medium size room available in my apartment in Washington Heights, less than 5 minutes walking to subway stops : 157th (1), 163rd (C), 168th (A,C, 1).Full size bed, big closet and work space, smartTV, high speed internet, A.C and more extras. You will share the common spaces ( Kitchen & bathroom ) with meLots of restaurants, bars, supermarkets, deli's and stores in the area.Subway rides from-to the aparment:Times Square 20 minWall St 40 minJFK Airport train/Howard's Beach (A) 1h15minRegistration numberOSE-STRREG-0001623",NA,NA,NA,"['https://a0.muscache.com/im/pictures/hosting/Hosting-1122575256700615814/original/cf37d1df-e2f6-40cb-82b6-ab840a568430.jpeg?im_w=720', 'https://a0.muscache.com/im/pictures/hosting/Hosting-1122575256700615814/original/bc6f1986-273e-4574-9716-614a90089aae.jpeg?im_w=720', 'https://a0.muscache.com/im/pictures/hosting/Hosting-1122575256700615814/original/830ea554-87a5-40ba-be2f-7962097ba595.jpeg?im_w=720', 'https://a0.muscache.com/im/pictures/hosting/Hosting-1122575256700615814/original/0d31eabf-185d-42a8-a88d-542dcf251560.jpeg?im_w=720', 'https://a0.muscache.com/im/pictures/hosting/Hosting-1122575256700615814/original/7df724c7-ae53-4e41-a680-d4f625b5d50a.jpeg?im_w=720', 'https://a0.muscache.com/im/pictures/hosting/Hosting-1122575256700615814/original/eac86d80-f8f8-48fa-a6d4-cec58997e126.jpeg?im_w=720', 'https://a0.muscache.com/im/pictures/hosting/Hosting-1122575256700615814/original/4b84edce-cf3a-449b-a870-55d86b65d67a.jpeg?im_w=720', 'https://a0.muscache.com/im/pictures/hosting/Hosting-1122575256700615814/original/10a21cdb-cf9e-4023-9d81-d9cba6ec255d.jpeg?im_w=720', 'https://a0.muscache.com/im/pictures/hosting/Hosting-1122575256700615814/original/bbe4f00c-6853-460a-9dfd-878574451a3a.jpeg?im_w=720', 'https://a0.muscache.com/im/pictures/hosting/Hosting-1122575256700615814/original/34b3e2e4-1455-476e-9bf1-8f8e6f96c590.jpeg?im_w=720', 'https://a0.muscache.com/im/pictures/hosting/Hosting-1122575256700615814/original/e53745ee-d4fb-4212-93f2-0186cd59fb1f.jpeg?im_w=720', 'https://a0.muscache.com/im/pictures/hosting/Hosting-1122575256700615814/original/03a110e1-8f0e-4467-86de-ef801e170667.jpeg?im_w=720', 'https://a0.muscache.com/im/pictures/hosting/Hosting-1122575256700615814/original/cb19e903-9cd7-4701-9ea4-9f300676bcff.jpeg?im_w=720', 'https://a0.muscache.com/im/pictures/hosting/Hosting-1122575256700615814/original/30e36f6d-3291-43ab-a80b-2428bcba2095.jpeg?im_w=720']"
