property_address,listing_link,bedrooms,bathroms,square_footage,price,listing_description,contact_name,contact_email,contact_phone_number,images
"Room in Manhattan, New York, United States",https://www.airbnb.com/rooms/858697692672545141?category_tag=Tag%3A8678&enable_m3_private_room=true&photo_id=1728488302&search_mode=regular_search&check_in=2024-08-05&check_out=2024-08-08&source_impression_id=p3_1722594440_P3T7bThsEn_O0x_2&previous_page_section_name=1000&federated_search_id=93438639-1222-42e1-ab3f-7b14bcb56819,1,1,NA,"7,","Just 2 blocks away from Penn Station, MSG and walking distance to Times Square, we offer guests a safe place to rest a stone’s throw away from all the city has to offer.We provide single occupancy rooms with open ceiling and lockable doors. Shared bathrooms include lockable shower doors, shampoo, shower gel and hairdryers.Continental Breakfast, WIFI, & towels are provided24/7 on-site staffThe spaceEach room has a single platform bed (75'' long and 45'' wide) and is intended for single occupancy only. The space includes a bed-side desk, shelf and a power outlet. There is luggage storage space underneath the bed. Shared bathrooms include lockable shower doors, free shampoo, shower gel and hairdryers. Towels are included in the room but additional towels can be requested. We recommend bringing flip-flops.Guest accessAccess to common areas, with comfy chairs, and desks for remote working.Common facilities include microwaves, fridge, iron & board.To ensure quality sleep, we do provide ear plugs, white noise sound machines, and nasal strips for guests if needed.During your stay24/7 staff on-siteFront desk is open from 7AM to midnightAirbnb messenger is actively managedAsk for our guides to the city (including restaurants for vegans & vegetarians)Volunteer with our staff at Soup KitchenOther things to noteYour stay helps us fund our soup kitchen in the East Village. Many of our guest have supported us feeding the homeless by volunteering their time. Please visit us @interfaith_nyc or ask any of our staff. Registration numberExempt",NA,NA,NA,"['https://a0.muscache.com/im/pictures/miso/Hosting-858697692672545141/original/a2da3f41-b8e4-440e-8aab-30ca1a915109.jpeg?im_w=720', 'https://a0.muscache.com/im/pictures/miso/Hosting-858697692672545141/original/0651db47-224a-4436-aa3b-9f7641ab2af2.jpeg?im_w=720', 'https://a0.muscache.com/im/pictures/miso/Hosting-858697692672545141/original/78d71063-4f56-45bb-b524-e782db62619a.jpeg?im_w=720', 'https://a0.muscache.com/im/pictures/miso/Hosting-858697692672545141/original/df5db60c-ad1f-4604-9ae8-0f2cac148aa8.jpeg?im_w=720', 'https://a0.muscache.com/im/pictures/miso/Hosting-858697692672545141/original/37105a23-68f4-4619-a7c3-2f7595efdd5f.jpeg?im_w=720', 'https://a0.muscache.com/im/pictures/miso/Hosting-858697692672545141/original/c24ac527-512f-4416-a338-c150ac61a053.jpeg?im_w=720', 'https://a0.muscache.com/im/pictures/miso/Hosting-858697692672545141/original/354ad40d-638b-4a6d-94bb-0208c3872872.jpeg?im_w=720', 'https://a0.muscache.com/im/pictures/miso/Hosting-858697692672545141/original/8427ac15-34d9-479a-86c2-88f41e7f0646.jpeg?im_w=720', 'https://a0.muscache.com/im/pictures/miso/Hosting-858697692672545141/original/66a723ba-6cfe-44e8-a583-e0e0a81bcdf9.jpeg?im_w=720', 'https://a0.muscache.com/im/pictures/miso/Hosting-858697692672545141/original/1094a260-9222-4c15-a80f-2ee66dfa376a.jpeg?im_w=720', 'https://a0.muscache.com/im/pictures/miso/Hosting-858697692672545141/original/0ee500cf-321b-423b-97d2-90ab66fdd82a.jpeg?im_w=720', 'https://a0.muscache.com/im/pictures/miso/Hosting-858697692672545141/original/3f45209d-b28c-40df-8c96-789a277806b9.jpeg?im_w=720', 'https://a0.muscache.com/im/pictures/miso/Hosting-858697692672545141/original/5a3c13af-81a2-4674-a7d7-fea410eff3df.jpeg?im_w=720', 'https://a0.muscache.com/im/pictures/miso/Hosting-858697692672545141/original/d3828425-3664-443e-9ced-0f7035ee5f72.jpeg?im_w=720', 'https://a0.muscache.com/im/pictures/miso/Hosting-858697692672545141/original/34feb4f3-8d75-495e-8f0a-75cb19c590a8.jpeg?im_w=720', 'https://a0.muscache.com/im/pictures/miso/Hosting-858697692672545141/original/02282fbf-62c0-4321-bcf8-ceebab10b682.jpeg?im_w=720', 'https://a0.muscache.com/im/pictures/miso/Hosting-858697692672545141/original/feb7c5cf-71e8-4c67-99ac-af8681f38de7.jpeg?im_w=720', 'https://a0.muscache.com/im/pictures/miso/Hosting-858697692672545141/original/f83e0194-adeb-4830-982f-0f6f3cc6061f.jpeg?im_w=720', 'https://a0.muscache.com/im/pictures/miso/Hosting-858697692672545141/original/4c6ead7c-d572-4ed1-852b-0467dacb93a0.jpeg?im_w=720', 'https://a0.muscache.com/im/pictures/miso/Hosting-858697692672545141/original/5426301c-bac5-4279-8584-697e807cbfa4.jpeg?im_w=720', 'https://a0.muscache.com/im/pictures/miso/Hosting-858697692672545141/original/f090ef63-2ddf-4f0e-8429-cbe9973dd9e2.jpeg?im_w=720', 'https://a0.muscache.com/im/pictures/miso/Hosting-858697692672545141/original/1a5e8861-196e-497b-a5b8-2fb4c1a22781.jpeg?im_w=720', 'https://a0.muscache.com/im/pictures/miso/Hosting-858697692672545141/original/881fe060-a95e-43b8-84e7-6f49ef7517dc.jpeg?im_w=720', 'https://a0.muscache.com/im/pictures/miso/Hosting-858697692672545141/original/1b1a7ae6-47c3-4656-a0ca-8c6b6d1dd035.jpeg?im_w=720', 'https://a0.muscache.com/im/pictures/miso/Hosting-858697692672545141/original/b899a8d0-3533-4b9a-9219-3c894eb176de.jpeg?im_w=720', 'https://a0.muscache.com/im/pictures/miso/Hosting-858697692672545141/original/cf8693c1-bc40-4ab5-bc41-43d9fde66367.jpeg?im_w=720', 'https://a0.muscache.com/im/pictures/miso/Hosting-858697692672545141/original/69ae9fd3-13be-4aba-99a5-3f56e3aa9c1b.jpeg?im_w=720', 'https://a0.muscache.com/im/pictures/miso/Hosting-858697692672545141/original/244f2c81-b4d3-48e8-9b54-a7298f726a80.jpeg?im_w=720', 'https://a0.muscache.com/im/pictures/miso/Hosting-858697692672545141/original/9f00cc43-b1c0-4388-bcdf-c5cb6dbc7049.jpeg?im_w=720', 'https://a0.muscache.com/im/pictures/miso/Hosting-858697692672545141/original/f8f86a04-b76e-4f8e-902f-4691389df3aa.jpeg?im_w=720', 'https://a0.muscache.com/im/pictures/miso/Hosting-858697692672545141/original/9ccfdc99-52da-4072-a5b8-bdf0a8207f37.jpeg?im_w=720']"
"Private room in hostel in New York, United States",https://www.airbnb.com/rooms/593322347340602809?search_mode=regular_search&check_in=2024-08-05&check_out=2024-08-08&source_impression_id=p3_1722594441_P3nBBWI0OkuMW4IH&previous_page_section_name=1000&federated_search_id=93438639-1222-42e1-ab3f-7b14bcb56819,1,1,NA,"6,","Great fit for solo travelers on budget: central and safe location, small individual sleeping cubicle with door and lock. Friendly staff on-site 24/7. Free vegetarian breakfast 24/7. Shared bathroom. Basic, but safe, peaceful, clean. Fresh sheets, pillows, towels, blankets provided. Free WIFI. Walking distance of Times Square, Penn Station, MSG, Port Authority Bus Terminal, Javits Center, Hudson Yards, Empire State Building, FIT. Easy to get to from JFK, LGA, EWR airports by public transport.The spaceThe small individual retreat cubicle is just for you and nobody else. Its door locks from inside and outside. Its walls are not going all the way up to the ceiling. The cubicle has a power outlet and is nicely air-conditioned.The cubicle room has a platform bed (75'' long and 45'' wide), a bed-side desk and a shelf. Luggage storage space underneath the platform bed. A power outlet in each cubicle.Fresh, clean sheets, pillows, towels, blankets providedAccess to a communal (shared with other guests) bathroom/shower/sink and a common lounge/breakfast area​The communal bathroom has multiple private shower cabins, private toilet cabins, and sinks. It's kept clean and tidy. Body/hair wash, hand soap provided The common lounge/breakfast area has a breakfast counter, refrigerator, microwave, filtered hot/cold/room temperature water dispenser, toaster. No stove and no sink​Each floor has 25 individual cubicles. We are booked at full capacity most of the time​Maximum length of stay is 28 consecutive nights in any given 30 days. We will not accept and immediately cancel consecutive reservations that add up to more than 28 consecutive nights.Guest accessYour cubicle is just for you and nobody else. You have access to a common lounge/breakfast area with free WIFI. Communal bathroom has multiple individual shower cabins, toilet cabins and sinks. We use the profits from the cubicle rooms here to provide hot meals for homeless people on the streets of New York City. You are invited to come to volunteer with us for two hours during your stay from 9:00AM until 10:30AM - we'll offer a little discount. No smoking, no alcohol, no meat/fish egg products allowed. Other things to noteWe're a vegetarian place: no bringing or cooking meat/fish/egg products . No smoking, no alcohol. No loud talking or other noise during quiet hours (8.30PM-8.30AM)Registration numberExempt",NA,NA,NA,"['https://a0.muscache.com/im/pictures/3ff75db4-8587-4b04-a3f3-a5ba820f5069.jpg?im_w=720', 'https://a0.muscache.com/im/pictures/77835c81-0620-463f-a13b-c7d547d6a4ba.jpg?im_w=720', 'https://a0.muscache.com/im/pictures/ef8f6034-90b1-43a1-95e7-4569faef4ca6.jpg?im_w=720', 'https://a0.muscache.com/im/pictures/1a66dc9d-b023-436f-a892-60f1f5b9ef7f.jpg?im_w=720', 'https://a0.muscache.com/im/pictures/fbcf8ae6-dfd8-4e1a-b297-10dcb2483191.jpg?im_w=720', 'https://a0.muscache.com/im/pictures/334c85bf-6009-4fdf-b8cd-6e01a653bfbd.jpg?im_w=720', 'https://a0.muscache.com/im/pictures/ea8708a9-e697-47fc-ae90-4811b81c71df.jpg?im_w=720', 'https://a0.muscache.com/im/pictures/8001a70f-7966-4cfd-8fec-b8e96806addd.jpg?im_w=720', 'https://a0.muscache.com/im/pictures/f0231f99-c781-4f14-a3e2-a16338087ce7.jpg?im_w=720', 'https://a0.muscache.com/im/pictures/b5adfaa6-3174-4248-9a34-fca95a17f60c.jpg?im_w=720', 'https://a0.muscache.com/im/pictures/0fefe33e-bb9f-4065-814c-fe12e9ecb354.jpg?im_w=720', 'https://a0.muscache.com/im/pictures/f23d3553-169c-464d-9ca6-3880688d6dde.jpg?im_w=720', 'https://a0.muscache.com/im/pictures/8fbab137-958d-44e7-b6d7-41f7eca8a215.jpg?im_w=720', 'https://a0.muscache.com/im/pictures/e7df1bf3-8936-4c99-b7fb-d6a12b296cec.jpg?im_w=720', 'https://a0.muscache.com/im/pictures/ef4446b3-c340-4c23-b645-9102fe4b17ef.jpg?im_w=720', 'https://a0.muscache.com/im/pictures/bae1d90a-3b08-4d0d-9e63-6c8c7ca2dc42.jpg?im_w=720', 'https://a0.muscache.com/im/pictures/77f98581-1101-43a5-82a0-c3919404e026.jpg?im_w=720', 'https://a0.muscache.com/im/pictures/886121c3-3e32-4668-a9ba-1f432842e582.jpg?im_w=720', 'https://a0.muscache.com/im/pictures/43bd9533-7285-42d7-a5b4-f2e088ed683f.jpg?im_w=720', 'https://a0.muscache.com/im/pictures/6370d4f0-04fc-40e1-bed3-b365a3901e8f.jpg?im_w=720', 'https://a0.muscache.com/im/pictures/8676fa79-7a5a-44f2-87f6-984207b7768b.jpg?im_w=720', 'https://a0.muscache.com/im/pictures/e805790a-aada-441c-9f99-ed237a65c7fb.jpg?im_w=720', 'https://a0.muscache.com/im/pictures/66ab413b-76a1-4823-a61b-e3c6b4d34798.jpg?im_w=720', 'https://a0.muscache.com/im/pictures/4792a227-9579-4449-8217-baa8c81b19a1.jpg?im_w=720', 'https://a0.muscache.com/im/pictures/6eab3fcd-18f5-495a-9710-3a22a8da247b.jpg?im_w=720', 'https://a0.muscache.com/im/pictures/cc43280d-2584-42ce-ab5f-161a6745da45.jpg?im_w=720', 'https://a0.muscache.com/im/pictures/6374b14b-6c48-4ac3-a9d6-6a530b425d65.jpg?im_w=720', 'https://a0.muscache.com/im/pictures/94720070-33ed-4fd2-963c-e6bae04e685e.jpg?im_w=720', 'https://a0.muscache.com/im/pictures/3460b937-e1b0-43d4-927f-0e8883c883f3.jpg?im_w=720', 'https://a0.muscache.com/im/pictures/305ca826-3e77-4889-a421-272575f9a137.jpg?im_w=720', 'https://a0.muscache.com/im/pictures/228495d5-8290-4958-b2e5-2785ef389a05.jpg?im_w=720', 'https://a0.muscache.com/im/pictures/369da106-34d1-4f16-899b-ab37471ad13d.jpg?im_w=720', 'https://a0.muscache.com/im/pictures/d6ac541f-f783-43ee-a731-56f13f5af665.jpg?im_w=720', 'https://a0.muscache.com/im/pictures/3fdb6ae9-a518-4f61-b6e8-95daa6aca5bc.jpg?im_w=720', 'https://a0.muscache.com/im/pictures/28a277a9-6bda-4b6b-ad07-e04c273f1c61.jpg?im_w=720', 'https://a0.muscache.com/im/pictures/3ccdc1e0-1cb4-4f3d-b67d-9cd515d9386f.jpg?im_w=720', 'https://a0.muscache.com/im/pictures/miso/Hosting-10482237/original/5f2d5161-3807-487b-9c62-ada16a229331.jpeg?im_w=720', 'https://a0.muscache.com/im/pictures/3631ace1-3951-48be-9d65-fa9df55932c4.jpg?im_w=720', 'https://a0.muscache.com/im/pictures/1e7f6635-d454-4509-a12a-ed1c81b3b8f9.jpg?im_w=720', 'https://a0.muscache.com/im/pictures/miso/Hosting-10482237/original/938e4ca9-ef34-4d46-8dde-e5937891215e.jpeg?im_w=720', 'https://a0.muscache.com/im/pictures/miso/Hosting-10482237/original/6126f876-7d91-4122-8640-706f4e233415.jpeg?im_w=720', 'https://a0.muscache.com/im/pictures/miso/Hosting-10482237/original/7913603f-d105-4766-8a16-d04c729fa45b.jpeg?im_w=720', 'https://a0.muscache.com/im/pictures/miso/Hosting-10482237/original/fc9d6a68-9c9f-4417-b846-d9888d43ca67.jpeg?im_w=720', 'https://a0.muscache.com/im/pictures/miso/Hosting-10482237/original/da08d3a9-9fc0-4ac0-8576-cdb4f192796f.jpeg?im_w=720', 'https://a0.muscache.com/im/pictures/miso/Hosting-10482237/original/a3c87ea1-8eb0-46e7-94d6-3a28c31e2fd8.jpeg?im_w=720', 'https://a0.muscache.com/im/pictures/miso/Hosting-10482237/original/504158b4-7828-41d2-bbc2-e5ffdff9bbe2.jpeg?im_w=720', 'https://a0.muscache.com/im/pictures/miso/Hosting-10482237/original/90e2a247-08f0-4d22-9782-4e7ce1a6900c.jpeg?im_w=720', 'https://a0.muscache.com/im/pictures/miso/Hosting-10482237/original/f95bc930-3fe3-48da-92ef-84b2e7fdc155.jpeg?im_w=720', 'https://a0.muscache.com/im/pictures/miso/Hosting-10482237/original/41006df9-9bec-43f3-9995-0038a47f476b.jpeg?im_w=720', 'https://a0.muscache.com/im/pictures/miso/Hosting-10482237/original/5d122875-cecc-40c1-9c92-7bb2eb0d03e2.jpeg?im_w=720']"
"Room in West New York, New Jersey, United States",https://www.airbnb.com/rooms/1105403969448940593?category_tag=Tag%3A8678&enable_m3_private_room=true&photo_id=1854219883&search_mode=regular_search&check_in=2024-08-05&check_out=2024-08-08&source_impression_id=p3_1722594441_P3AdHhJjJkAi7sGK&previous_page_section_name=1000&federated_search_id=93438639-1222-42e1-ab3f-7b14bcb56819,1,1,NA,"4,","Our private room is clean, comfortable. Perfect for you. This place is friendly. You have always clean sheets and towels. You can enter the place with passcode. You can use the living room, kitchen, bathroom just be very clean after you finish ..Port authority is 15 minutes with bus. Whatever you need, don’t hesitate to ask me. Other things to note; room is the second floor so please be very quiet upstair..Note A:Parking isn’t available, if you have a car, book other listings please!!!",NA,NA,NA,"['https://a0.muscache.com/im/pictures/hosting/Hosting-1105403969448940593/original/8116bea9-1278-4035-bd9f-0d210f32da4c.jpeg?im_w=720', 'https://a0.muscache.com/im/pictures/hosting/Hosting-1105403969448940593/original/9bc3e46b-600c-4e90-8377-5af3b56bb7c7.jpeg?im_w=720', 'https://a0.muscache.com/im/pictures/hosting/Hosting-1105403969448940593/original/b41df3b0-a663-45cf-9f24-baf925ebcc8e.jpeg?im_w=720', 'https://a0.muscache.com/im/pictures/hosting/Hosting-1105403969448940593/original/6762b669-7acd-4418-8421-ca5af9b6a172.jpeg?im_w=720', 'https://a0.muscache.com/im/pictures/hosting/Hosting-1105403969448940593/original/ff6e1a7d-3f20-413c-a626-e6509d91de52.jpeg?im_w=720', 'https://a0.muscache.com/im/pictures/hosting/Hosting-1105403969448940593/original/f14b2c7d-9ca2-499a-8abe-7c013ca00c39.jpeg?im_w=720', 'https://a0.muscache.com/im/pictures/hosting/Hosting-1105403969448940593/original/48194f77-03ee-492b-a34d-7bcf7d89fab8.jpeg?im_w=720', 'https://a0.muscache.com/im/pictures/hosting/Hosting-1105403969448940593/original/ecd9437a-d636-4641-972d-eac8d709822e.jpeg?im_w=720', 'https://a0.muscache.com/im/pictures/hosting/Hosting-1105403969448940593/original/51a8b720-6553-4da6-8544-e9addb1a9b81.jpeg?im_w=720', 'https://a0.muscache.com/im/pictures/hosting/Hosting-1105403969448940593/original/7f5a959c-b4f7-42e6-8bc0-3f545a0cc572.jpeg?im_w=720', 'https://a0.muscache.com/im/pictures/hosting/Hosting-1105403969448940593/original/e4ffdc25-10f6-4244-b138-42986029b13f.jpeg?im_w=720', 'https://a0.muscache.com/im/pictures/hosting/Hosting-1105403969448940593/original/870e1fb6-3927-42c3-a832-7cee033f0bbe.jpeg?im_w=720', 'https://a0.muscache.com/im/pictures/hosting/Hosting-1105403969448940593/original/f0a85847-3d86-44e5-abda-f91076380e7e.jpeg?im_w=720', 'https://a0.muscache.com/im/pictures/hosting/Hosting-1105403969448940593/original/2d48ccfe-c86d-4713-9462-c666c8ae0094.jpeg?im_w=720', 'https://a0.muscache.com/im/pictures/hosting/Hosting-1105403969448940593/original/ef0f97be-2d29-414e-bd2e-636a5f2e5157.jpeg?im_w=720', 'https://a0.muscache.com/im/pictures/hosting/Hosting-1105403969448940593/original/acad2d29-8ca3-4746-a43e-d5f891c9138c.png?im_w=720', 'https://a0.muscache.com/im/pictures/hosting/Hosting-1105403969448940593/original/800ab3db-aac0-4ff5-9089-48d5827759be.jpeg?im_w=720']"
"Room in New York, United States",https://www.airbnb.com/rooms/5406041?category_tag=Tag%3A8678&enable_m3_private_room=true&photo_id=135520366&search_mode=regular_search&check_in=2024-08-05&check_out=2024-08-08&source_impression_id=p3_1722594441_P3Q8zB2BzeD7YPM5&previous_page_section_name=1000&federated_search_id=93438639-1222-42e1-ab3f-7b14bcb56819,1,1,NA,"8,","Spacious 3 BR, 2BR duplex in the heart of East Village with all amenities (laundry, ac, wireless internet, Pro Stove/Oven, tastefully furnished, close to park, movies, surrounded by restaurants in walking distance. Never a dull moment.The spaceA duplex is a unique living space because while it is an apartment with a very central location, we also have 2 stories which makes it more spacious and more like a home at the same time as there are two floors, which tends to provide a bit more privacy for guests. The light is great and the apartment's decor is pleasing to the eye. We have wood floors, moroccan tiles and lots of lighting on dimmers to control for ambiance.The room measures 10' x 15' and the modern bed is a queen size: dimensions are: 60"" x 80"".Guest accessEntire duplex: living room, kitchen, private bathroom, hallways, only limited access is to my bedroom and officeDuring your stayAlways try my best to greet in person on arrival unless in the case of emergency ( I am a midwife), in which I will leave key in the lock box. My wish is to interact as often as guests need face to face and by phone or the app, if I""m out working or not home. I am working Tuesday and Wednesday out of the house until early afternoon. Out some evenings, can't say with certainty which days of the week.Other things to noteThe aesthetics of the house are lovely. I'm big into interior design. I want you to feel welcome in NYC. NYC can be a very intimidating and overwhelming city. I hope I can help you effectively navigate so you can have a fruitful trip. I am a consummate traveler, lived all over the world and understand what it is like to come to a strange place. I hope my home can be a pied-a-terre welcome respite from your explorations of the cities many, many cultural opportunities and goings-on. Welcome!!! Your host is happy to report that I am now fully vaccinated!Registration numberOSE-STRREG-0000488",NA,NA,NA,"['https://a0.muscache.com/im/pictures/e9832793-92ce-4c69-a8ee-380a99ab4a11.jpg?im_w=720', 'https://a0.muscache.com/im/pictures/d3cad1ab-abf9-42f5-8592-3c1ad175eca6.jpg?im_w=720', 'https://a0.muscache.com/im/pictures/e0f3fe1b-68d9-499d-af70-6bdad1c78f78.jpg?im_w=720', 'https://a0.muscache.com/im/pictures/ab8e5c91-c66f-4b65-ae8c-64aac3217039.jpg?im_w=720', 'https://a0.muscache.com/im/pictures/23019bc0-3e07-413d-a488-b6aa0843cded.jpg?im_w=720', 'https://a0.muscache.com/im/pictures/ad289380-355a-449f-8841-27668f32eda6.jpg?im_w=720', 'https://a0.muscache.com/im/pictures/be23fc95-74f1-4d71-9575-8778a2203f2e.jpg?im_w=720', 'https://a0.muscache.com/im/pictures/6cf86810-66e3-4b96-9d0b-2c7fa3d9a940.jpg?im_w=720', 'https://a0.muscache.com/im/pictures/40c7e071-c776-47bb-b28f-7fac5849fed6.jpg?im_w=720', 'https://a0.muscache.com/im/pictures/d5456bc7-b915-489f-a11a-951091237741.jpg?im_w=720', 'https://a0.muscache.com/im/pictures/c024f384-3ef1-467f-895d-67d93d6b29df.jpg?im_w=720', 'https://a0.muscache.com/im/pictures/83beb2aa-c71d-4571-9d0d-ff6acd5c8808.jpg?im_w=720', 'https://a0.muscache.com/im/pictures/205d9168-9075-423c-a0f7-6639ba50a844.jpg?im_w=720', 'https://a0.muscache.com/im/pictures/24da2a7a-17df-4a89-8f28-f03ded68aeef.jpg?im_w=720', 'https://a0.muscache.com/im/pictures/8ec6cad3-3634-48a2-add8-8d7a08c18dde.jpg?im_w=720', 'https://a0.muscache.com/im/pictures/7170de17-91de-457c-b91a-f0a371669680.jpg?im_w=720', 'https://a0.muscache.com/im/pictures/a833c4ee-c154-4c91-a2da-c8c1cbfb8fab.jpg?im_w=720', 'https://a0.muscache.com/im/pictures/6a4a1cd4-17db-4f34-9f30-0d64aa0086ad.jpg?im_w=720', 'https://a0.muscache.com/im/pictures/2bce37f5-b096-403e-bb66-682bde7eed91.jpg?im_w=720', 'https://a0.muscache.com/im/pictures/9c667709-4ae5-4c60-b51f-4dafe96c5c9f.jpg?im_w=720', 'https://a0.muscache.com/im/pictures/3d69fcc3-1833-4349-80fd-4ebd1534209e.jpg?im_w=720', 'https://a0.muscache.com/im/pictures/cdbbdc5e-cb71-4e7b-9e72-3a7b885928bd.jpg?im_w=720', 'https://a0.muscache.com/im/pictures/04dcee79-490f-4e18-889e-c599336661e0.jpg?im_w=720', 'https://a0.muscache.com/im/pictures/33121a7d-1888-4a35-97d5-d2ccd762d760.jpg?im_w=720', 'https://a0.muscache.com/im/pictures/1e8d365a-ec64-4f17-9a26-5b1af7eabc9a.jpg?im_w=720']"
"Room in Guttenberg, New Jersey, United States",https://www.airbnb.com/rooms/39465135?category_tag=Tag%3A8678&enable_m3_private_room=true&photo_id=1921035847&search_mode=regular_search&check_in=2024-08-05&check_out=2024-08-08&source_impression_id=p3_1722594441_P3wEzcdhz8tnT7T8&previous_page_section_name=1000&federated_search_id=93438639-1222-42e1-ab3f-7b14bcb56819,1,1,NA,"3,","Please note, this is a room rental with a shared bathroom.Our home is situated in a safe and diverse neighborhood, close to grocery stores, bars, restaurants, bus stops, and parks. Our location is convenient for public transit access to NYC's Times Square.For the comfort and respect of everyone in our family, smoking is not allowed anywhere on our property. Additionally, under no circumstances is walking around naked permitted. We appreciate your understanding.The space*******Please note: Due to an extreme number of bad experiences including but not limited to theft, destruction of property, invasion of privacy and disrespecting other guests, we regret to inform that we do not host local guests. This property is available exclusively for visitors only. Thank you for your understanding.*******The room provided has a minimalist design for more comfort during your stay.Please be aware that parking in our town can be challenging. A $5.00 parking permit is required per night, and finding a parking spot can be difficult. Additionally, there are no parking garages available. We are not responsible for any parking tickets you may receive, so we recommend considering alternative transportation options to ensure a smoother visit.This listing offers a comfortable room with access to a shared bathroom. Perfect for solo travelers or couples looking to explore New York City and its surrounding areas, this room provides a peaceful haven after a day of sightseeing. Enjoy convenient access to public transportation, local shops, and restaurants, making it easy to experience both urban excitement and suburban tranquility. My wife and I are committed to ensuring a pleasant stay, providing essentials and local tips to enhance your visit. Embrace comfort and convenience at this charming Airbnb in Guttenberg!Guest accessRoom and bathroom onlyDuring your stayAnytime on Airbnb AppOther things to noteThere’s no kitchen available for this listing",NA,NA,NA,"['https://a0.muscache.com/im/pictures/hosting/Hosting-39465135/original/e5f0472d-28ae-4baa-9cef-d03254634032.jpeg?im_w=720', 'https://a0.muscache.com/im/pictures/hosting/Hosting-39465135/original/90c6a86d-47be-4e0f-999f-78f3391be86f.jpeg?im_w=720', 'https://a0.muscache.com/im/pictures/hosting/Hosting-39465135/original/39b9b296-0dd8-4b2f-830d-1ef93cff3a41.jpeg?im_w=720', 'https://a0.muscache.com/im/pictures/hosting/Hosting-39465135/original/7e76d01c-5f3f-45fa-9d5f-72efb004b498.jpeg?im_w=720', 'https://a0.muscache.com/im/pictures/hosting/Hosting-39465135/original/b4cadb77-f19c-4c11-9660-04c59bc3fe5a.jpeg?im_w=720', 'https://a0.muscache.com/im/pictures/b9c75302-4af5-4d00-ba4b-cda91b4c8efb.jpg?im_w=720', 'https://a0.muscache.com/im/pictures/c1b857d6-ce21-45b2-a5f2-2cf1fb6ccb86.jpg?im_w=720', 'https://a0.muscache.com/im/pictures/0792ee07-6e47-4abe-908d-249a4553abf5.jpg?im_w=720', 'https://a0.muscache.com/im/pictures/69c9afe5-aa8c-479e-bb1a-c46a3b90040e.jpg?im_w=720']"
"Room in New York, United States",https://www.airbnb.com/rooms/1162454771886304951?category_tag=Tag%3A8678&enable_m3_private_room=true&photo_id=1913272135&search_mode=regular_search&check_in=2024-08-05&check_out=2024-08-08&source_impression_id=p3_1722594441_P3FvWCxAPO-Iby-C&previous_page_section_name=1000&federated_search_id=93438639-1222-42e1-ab3f-7b14bcb56819,1,1,NA,"8,",Registration numberOSE-STRREG-0002171,NA,NA,NA,"['https://a0.muscache.com/im/pictures/miso/Hosting-1162454771886304951/original/a475e529-4443-400e-a322-41baea96edb2.png?im_w=720', 'https://a0.muscache.com/im/pictures/miso/Hosting-1162454771886304951/original/c528678a-0d3a-4991-9e4d-8e382a7a99fe.png?im_w=720', 'https://a0.muscache.com/im/pictures/miso/Hosting-1162454771886304951/original/683d2687-3732-4365-9957-096a93000161.png?im_w=720', 'https://a0.muscache.com/im/pictures/miso/Hosting-1162454771886304951/original/123acb91-de8a-4229-a172-78110fdac213.png?im_w=720', 'https://a0.muscache.com/im/pictures/miso/Hosting-1162454771886304951/original/81a24c7c-e256-47b4-b721-5fec00eb828b.png?im_w=720']"
