property_address,listing_link,bedrooms,bathroms,square_footage,price,listing_description,contact_name,contact_email,contact_phone_number,images
"Room in Brooklyn, New York, United States",https://www.airbnb.com/rooms/932893071035345056?category_tag=Tag%3A8678&enable_m3_private_room=true&photo_id=1807362177&search_mode=regular_search&check_in=2024-08-05&check_out=2024-08-08&source_impression_id=p3_1722594441_P3XUe96TT5kW5Tom&previous_page_section_name=1000&federated_search_id=93438639-1222-42e1-ab3f-7b14bcb56819,2,1,NA,"10,","Come stay in a newly developed, modern duplex. I’m a first time home buyer and am looking forward to sharing my space with others eager to experience the best of New York. My home reflects a passions for art, social justice, and modern design. I hope you enjoy your stay!The spaceThe basement level is your own private studio, designed with a mixture of modern and vintage pieces. The room includes a relaxing velvet sofa, an LG flatscreen TV, full size bed, blue tooth speaker system, a shared washer/dryer, and your own private half bathroom and entrance to the unit. The first floor is the shared kitchen, living room and full bathroom, equipped with modern appliances and mid century furniture. Please note: there is no door on the stairwell connecting the basement and first floor, however the downstairs room is private and secluded. I will be out of the house for most of your stay. On occasion, I may need to use the washer/ dryer downstairs but will always communicate ahead of time.Guest accessGuest will have access to shared spaces; the kitchen, living room and shared bathroom, and a private studio and half bathroom. The communal roof is also available to guests. My personal bedroom is off limits.During your stayI will be in and out of the apartment during your stay. I work during the week and am typically free during the weekends. I am happy to interact with guests and am always available via text or phone to support.Other things to notePlease remember, this my home. I am a first time home owner using Airbnb to help cover mortgage cost. I ask that you please respect my home as if it were your own and follow these simple community rules: 1. No smoking of any kind is allowed within the building. If you’d like to smoke, please go outside of the building off the property and do not leave any debris.2. Please throw away all trash upon checkout and clean up after yourself throughout your stay.3. If you cook, please turn on the fan and vent above the oven and clean up after yourself.4. No parties or large number of guests allowed.5. The key must remain INSIDE the lockbox throughout your entire stay. Please do not take the key with you. You will open the lockbox and use the key each time you need to re-enter.6. Please note: there is no door on the stairwell connecting the two floors, however the downstairs room is private and secluded. I will be out of the house for most of your stay. On occasion, I may need to use the washer/ dryer downstairs but will always communicate ahead of time.If any issues or concerns arise, please don’t hesitate to reach out. I am responsive and here to help ensure you have a wonderful stay. Thank you for the understanding and respecting these rules!Registration numberOSE-STRREG-0000365",NA,NA,NA,"['https://a0.muscache.com/im/pictures/hosting/Hosting-932893071035345056/original/d6e1d649-1bcf-4d03-a276-5c0a4f325258.jpeg?im_w=720', 'https://a0.muscache.com/im/pictures/hosting/Hosting-932893071035345056/original/5626acd3-02c7-4769-94e6-11c638069c2c.jpeg?im_w=720', 'https://a0.muscache.com/im/pictures/hosting/Hosting-932893071035345056/original/874aa510-7d61-4679-b58f-4cad964be9ce.jpeg?im_w=720', 'https://a0.muscache.com/im/pictures/hosting/Hosting-932893071035345056/original/07a4e205-6314-4f6e-b27b-bbbdbdf3fd25.jpeg?im_w=720', 'https://a0.muscache.com/im/pictures/hosting/Hosting-932893071035345056/original/c1554ef1-f5ca-4ba0-b510-37d9c822e721.jpeg?im_w=720', 'https://a0.muscache.com/im/pictures/hosting/Hosting-932893071035345056/original/1c28365e-bdd9-4437-9049-a98fa06ff8af.jpeg?im_w=720', 'https://a0.muscache.com/im/pictures/hosting/Hosting-932893071035345056/original/647ddf4d-ee3b-4ad2-9058-a76de174e0b6.jpeg?im_w=720', 'https://a0.muscache.com/im/pictures/hosting/Hosting-932893071035345056/original/bc53f9ff-60c1-400a-b06f-0877876a1980.jpeg?im_w=720', 'https://a0.muscache.com/im/pictures/hosting/Hosting-932893071035345056/original/376f68c5-dc42-4206-b544-70ac67003714.jpeg?im_w=720', 'https://a0.muscache.com/im/pictures/hosting/Hosting-932893071035345056/original/d57557a0-4331-43ee-95b8-d655e6b1979f.jpeg?im_w=720', 'https://a0.muscache.com/im/pictures/hosting/Hosting-932893071035345056/original/41857fcd-5b24-4c9e-9c75-96c2c72a03e2.jpeg?im_w=720', 'https://a0.muscache.com/im/pictures/hosting/Hosting-932893071035345056/original/6907b54b-26cd-4118-b68c-fa419b02a1a4.jpeg?im_w=720', 'https://a0.muscache.com/im/pictures/hosting/Hosting-932893071035345056/original/dfdea491-7027-424a-b41f-f68773c57f41.jpeg?im_w=720', 'https://a0.muscache.com/im/pictures/hosting/Hosting-932893071035345056/original/baf9a9a1-ec9e-4eb5-86f7-244a7c49fb19.jpeg?im_w=720', 'https://a0.muscache.com/im/pictures/hosting/Hosting-932893071035345056/original/9878890e-fbcc-4f27-b0e6-4a9f5b01e3df.jpeg?im_w=720', 'https://a0.muscache.com/im/pictures/hosting/Hosting-932893071035345056/original/4b37e647-0f82-4024-8aca-f1086b405caa.jpeg?im_w=720', 'https://a0.muscache.com/im/pictures/hosting/Hosting-932893071035345056/original/c0df5a2b-ceac-452d-8b7b-2be63c0dc21d.jpeg?im_w=720', 'https://a0.muscache.com/im/pictures/hosting/Hosting-932893071035345056/original/fb801791-1df9-4493-ac08-acc4f8c6a878.jpeg?im_w=720', 'https://a0.muscache.com/im/pictures/hosting/Hosting-932893071035345056/original/419e387d-d683-434f-9b2e-b31731b80e8a.jpeg?im_w=720', 'https://a0.muscache.com/im/pictures/hosting/Hosting-932893071035345056/original/6e8965d7-f40c-4927-baf7-ba654f55c79d.jpeg?im_w=720', 'https://a0.muscache.com/im/pictures/hosting/Hosting-932893071035345056/original/8c791153-8e41-45f8-9c66-46b35c05100c.jpeg?im_w=720', 'https://a0.muscache.com/im/pictures/hosting/Hosting-932893071035345056/original/78f82150-ef2f-4554-8085-71593b76ed8f.jpeg?im_w=720', 'https://a0.muscache.com/im/pictures/hosting/Hosting-932893071035345056/original/fe04a0cf-a643-4292-897a-696dcaa602b4.jpeg?im_w=720', 'https://a0.muscache.com/im/pictures/hosting/Hosting-932893071035345056/original/edfeb3ba-9024-4b71-ba41-e06a1c64b43a.jpeg?im_w=720', 'https://a0.muscache.com/im/pictures/hosting/Hosting-932893071035345056/original/d01fbe36-b62e-480d-8450-2a0c0657e145.jpeg?im_w=720', 'https://a0.muscache.com/im/pictures/hosting/Hosting-932893071035345056/original/88d8cd98-8561-4722-868e-56428fbfc345.jpeg?im_w=720', 'https://a0.muscache.com/im/pictures/hosting/Hosting-932893071035345056/original/e08b3f28-2dc6-49e4-8d10-92122f17fbc7.jpeg?im_w=720', 'https://a0.muscache.com/im/pictures/hosting/Hosting-932893071035345056/original/3f5cdf9d-b42c-4afc-b731-a88d845a1032.jpeg?im_w=720', 'https://a0.muscache.com/im/pictures/hosting/Hosting-932893071035345056/original/fa02601d-85d9-4a0d-9766-b1bb1300a502.jpeg?im_w=720', 'https://a0.muscache.com/im/pictures/hosting/Hosting-932893071035345056/original/d29fe974-053a-4989-b575-5b5bc2f100c5.jpeg?im_w=720', 'https://a0.muscache.com/im/pictures/hosting/Hosting-932893071035345056/original/e1b213c5-c7cb-49a0-b00f-0f76dc2f6aa2.jpeg?im_w=720', 'https://a0.muscache.com/im/pictures/hosting/Hosting-932893071035345056/original/043e1073-34b1-412f-be96-7312efa43081.jpeg?im_w=720', 'https://a0.muscache.com/im/pictures/hosting/Hosting-932893071035345056/original/d08d5e66-0f26-4d2c-9491-b1436ae1581c.jpeg?im_w=720', 'https://a0.muscache.com/im/pictures/hosting/Hosting-932893071035345056/original/fa53aad2-5122-4f3e-b136-6571a71444ed.jpeg?im_w=720', 'https://a0.muscache.com/im/pictures/hosting/Hosting-932893071035345056/original/c2387cf8-f850-4389-af42-a43acae9d6f7.jpeg?im_w=720', 'https://a0.muscache.com/im/pictures/hosting/Hosting-932893071035345056/original/e5de2d45-fc37-48ab-b7d4-41b5c0bbc3c3.jpeg?im_w=720']"
"Room in Brooklyn, New York, United States",https://www.airbnb.com/rooms/22515792?category_tag=Tag%3A8678&enable_m3_private_room=true&photo_id=942858194&search_mode=regular_search&check_in=2024-08-05&check_out=2024-08-08&source_impression_id=p3_1722594441_P3TA9N2XfR066juE&previous_page_section_name=1000&federated_search_id=93438639-1222-42e1-ab3f-7b14bcb56819,1,1,NA,"11,","Welcome to our funky and creative guesthouse in the Bedstuy/Bushwick area of Brooklyn! We host guests from all around the world. This is a secure private bedroom and private bathroom on the main entryway floor in a classic brownstone townhouse. The rest of the house has shared spaces. Only an 8 minute walk to the closest subway. We offer an easy self serve check-in, with front door code entry, and the option to drop your luggage off before check-in and leave it after checkout to pick up later.The spaceA private bedroom on the main entryway floor in a classic brownstone townhouse. You will have a private bedroom and bathroom with optional shared common spaces.Guest accessYou will have access to a private bedroom and bathroom on the main floor. Upstairs is a shared full kitchen, living room, and dining area. In the front of the house we have a garden with patio furniture you are welcome to enjoy.During your stayOur house manager lives below, who is available for cleaning and onsite emergencies. We will be more than happy to assist you with anything during your stay by phone or Airbnb messaging. Be aware we do not offer 24 hour service, but we will help you as soon as we can.Other things to noteThe house manager may need access to the apartment, but will not go in your bedroom.Registration numberExempt",NA,NA,NA,"['https://a0.muscache.com/im/pictures/85e02b16-e312-4666-b1b7-58daeac8a82c.jpg?im_w=720', 'https://a0.muscache.com/im/pictures/787a5ffd-dc11-4357-b313-99a106609977.jpg?im_w=720', 'https://a0.muscache.com/im/pictures/51f00387-9b9d-40f6-9772-90308ef711d2.jpg?im_w=720', 'https://a0.muscache.com/im/pictures/bdbdf212-14b0-40ad-849d-0b7876db593d.jpg?im_w=720', 'https://a0.muscache.com/im/pictures/508893ad-504d-43ff-9c03-04ed86ff23f5.jpg?im_w=720', 'https://a0.muscache.com/im/pictures/7482a430-64a0-49bc-9726-805a46ee442d.jpg?im_w=720', 'https://a0.muscache.com/im/pictures/e22a442f-1c8e-4edd-b840-8f14b354cc13.jpg?im_w=720', 'https://a0.muscache.com/im/pictures/309d061b-822b-4183-a179-bba602eb89d6.jpg?im_w=720', 'https://a0.muscache.com/im/pictures/125bf18e-addd-41dd-8aee-6035a7487c3f.jpg?im_w=720', 'https://a0.muscache.com/im/pictures/e4e80579-2e99-4e65-a603-55256888fc87.jpg?im_w=720', 'https://a0.muscache.com/im/pictures/4e6a28e7-69e5-4002-b687-fbbf16874950.jpg?im_w=720', 'https://a0.muscache.com/im/pictures/e77b586a-2ea0-4630-9d31-9b813f0ea69e.jpg?im_w=720', 'https://a0.muscache.com/im/pictures/eb76bff9-bcca-46ff-aea1-c3acb2d98dc4.jpg?im_w=720', 'https://a0.muscache.com/im/pictures/54fbbb07-df2d-4d95-a3a8-7d7ad82e48d0.jpg?im_w=720', 'https://a0.muscache.com/im/pictures/63b1d106-b741-44d1-a2f7-205de98cb34e.jpg?im_w=720', 'https://a0.muscache.com/im/pictures/06be9378-f3ee-4d4c-ae48-fc8f9b91a931.jpg?im_w=720']"
"Room in Queens, New York, United States",https://www.airbnb.com/rooms/991424612657080439?category_tag=Tag%3A8678&enable_m3_private_room=true&photo_id=1749679929&search_mode=regular_search&check_in=2024-08-05&check_out=2024-08-08&source_impression_id=p3_1722594441_P3PUDvmpIkKnwWmC&previous_page_section_name=1000&federated_search_id=93438639-1222-42e1-ab3f-7b14bcb56819,1,1,NA,"7,","The apartment is located in heart of residential Astoria in a very safe neighborhood close to public transportation and Manhattan. The best spot for travelersProbably the safest neighborhood in the city where you can safely walk 24/7 and be so close to the busy city.Steps away from N and W train station which can take you to:Manhattan: 10 minTimes Square: 20 minLaGuardia (LGA) airport: 10 minThe spaceExperience authentic New York as local with super comfortable memory foam queen size mattress.Guest accessYou will have a private bedroom with lock to yourself, and you will share bathroom and kitchen with others. Please note we uphold to a high cleanliness standards and keep our place always crystal clean. We expect the same from all our guests. Please clean after yourself.Other things to noteYou will have a private bedroom private to you with a lock. Kitchen and both bathrooms are shared with other people.Registration numberExempt",NA,NA,NA,"['https://a0.muscache.com/im/pictures/miso/Hosting-991424612657080439/original/80230770-6994-4df4-924f-c5cd4285b143.jpeg?im_w=720', 'https://a0.muscache.com/im/pictures/miso/Hosting-991424612657080439/original/99f1685f-a61e-4198-8a43-7177f8a5fdcb.jpeg?im_w=720', 'https://a0.muscache.com/im/pictures/miso/Hosting-991424612657080439/original/9099c1ab-d0b4-455a-9557-bf727b13c2b2.jpeg?im_w=720', 'https://a0.muscache.com/im/pictures/miso/Hosting-991424612657080439/original/09fa0737-675c-4f4d-bac0-8f6c8ca4339a.jpeg?im_w=720', 'https://a0.muscache.com/im/pictures/miso/Hosting-991424612657080439/original/baa5e435-1c5e-4b76-96fc-2c4ff3c4cbc2.jpeg?im_w=720', 'https://a0.muscache.com/im/pictures/miso/Hosting-991424612657080439/original/cc393b50-299d-458d-91ae-c8e474e123c2.jpeg?im_w=720', 'https://a0.muscache.com/im/pictures/miso/Hosting-991424612657080439/original/78f61e08-f43b-419d-bc6a-11b8bc911b6b.jpeg?im_w=720', 'https://a0.muscache.com/im/pictures/miso/Hosting-991424612657080439/original/876bbc1d-4269-4717-b920-e01eee678a0d.jpeg?im_w=720', 'https://a0.muscache.com/im/pictures/miso/Hosting-991424612657080439/original/ab465edf-ce6d-4e9f-83ee-dc67d125b4cd.jpeg?im_w=720', 'https://a0.muscache.com/im/pictures/miso/Hosting-991424612657080439/original/6d8d0480-e0b1-4833-bcc6-9253e0205d74.jpeg?im_w=720', 'https://a0.muscache.com/im/pictures/miso/Hosting-991424612657080439/original/08ceb4e9-150f-44cb-9d1d-5f9a756893bc.jpeg?im_w=720', 'https://a0.muscache.com/im/pictures/miso/Hosting-991424612657080439/original/64a0325c-b51d-4e70-8ddb-4cd52bd6218b.jpeg?im_w=720']"
"Room in New York, United States",https://www.airbnb.com/rooms/48682927?category_tag=Tag%3A8678&enable_m3_private_room=true&photo_id=1800867799&search_mode=regular_search&check_in=2024-08-05&check_out=2024-08-08&source_impression_id=p3_1722595577_P3enZn_KKsz9jyI0&previous_page_section_name=1000&federated_search_id=66fd87c1-1986-4153-b0a4-79bd35fa6b23,2,1,NA,"22,","Recently renovated apartment in NYC's Upper West Side. Close to Central Park & National History Museum. Great location close to restaurants & boutiques. Enjoy delicious food while spending time in the neighborhood or stop by the Farmer's MarketCiti bike & subway stops (1, B, C lines) in a block. 2 & 3 are a short walk away.Includes kitchenette (fridge, coffee, microwave, hotplate, toaster), bedroom & a den w/ a futon. Bathroom includes shower, tub, heated floors.NO SMOKING or PARTIES.The spaceKitchenette includes a refrigerator, microwave, electric cooktop, toaster, espresso machine and utensils.1 king bed and futon1 dedicated bathroom with shower/tub and heated floorsWorking area and denGuest accessBathroom, Kitchenette, Den and BedroomDuring your stayWe're here to help you make the most of your stay in NYC, but don't want to cramp your style either. Reach out anytime.Please remember that NYC law limits us to 2 guests over the age of 4. If you arrive with more than 2 guests your reservation will be canceled without a refund.Other things to noteABSOLUTELY NO SMOKINGNO PARTIESRegistration numberOSE-STRREG-0000427",NA,NA,NA,"['https://a0.muscache.com/im/pictures/miso/Hosting-48682927/original/4ee8dd2d-9e21-4e62-8ed4-7851bd5d9fd2.jpeg?im_w=720', 'https://a0.muscache.com/im/pictures/miso/Hosting-48682927/original/5be2a4d1-519e-49d6-99b8-a70e62ea654c.jpeg?im_w=720', 'https://a0.muscache.com/im/pictures/miso/Hosting-48682927/original/ff3f1dcf-cc06-4f8e-97da-499783cfc045.jpeg?im_w=720', 'https://a0.muscache.com/im/pictures/miso/Hosting-48682927/original/af435fae-6db7-467c-b09a-17ff83a6b1ac.jpeg?im_w=720', 'https://a0.muscache.com/im/pictures/miso/Hosting-48682927/original/0a9805e6-ab2a-41b5-aad7-9e5e2b5cf78c.jpeg?im_w=720', 'https://a0.muscache.com/im/pictures/miso/Hosting-48682927/original/435c208c-3e97-40ab-a6c2-a829d28f5dd5.jpeg?im_w=720', 'https://a0.muscache.com/im/pictures/miso/Hosting-48682927/original/3aeed717-9d13-4f14-aaf2-970d5b513cfd.jpeg?im_w=720', 'https://a0.muscache.com/im/pictures/miso/Hosting-48682927/original/315cdc4b-25aa-4172-b54c-c83fdea0b8f4.jpeg?im_w=720', 'https://a0.muscache.com/im/pictures/miso/Hosting-48682927/original/e42fc0c2-c8d1-4d99-9740-a09ffbddae5d.jpeg?im_w=720']"
"Entire rental unit in New York, United States",https://www.airbnb.com/rooms/1159053260701230398?search_mode=regular_search&check_in=2024-08-05&check_out=2024-08-08&source_impression_id=p3_1722595578_P33fb6G77Ge144uE&previous_page_section_name=1000&federated_search_id=66fd87c1-1986-4153-b0a4-79bd35fa6b23,1,1,NA,"10,","- Quiet Studio Apartment with PRIVATE KITCHEN & SHOWER ROOM wit tub.- TOILET ROOMs are SHARED on shared hallway. (2 toilet rooms / 4 units) - My street allows FREE PARKING.- beautiful apt by Union Square Park, Cozy, comfortable, got everything you need. Full size bed & aTwin size sofa bed can into bed.- 14st Union Sq Station, (N,Q,R,W,4,5,6,L) subway lines, easy access to major place in NY.- Many Major stores, restaurants, bars, parks.The space：Best for solo, couple, with friends, family stay. ：Also Good for those who want to save money.：My apartment faces to backside of building, It's Sunny and very quiet.Other things to note・There is some of Towels and Toilet Paper will be provided. ・My Airbnb does not provide extla towel or paper item replacements or refills.・It's good to have a bathroom slipperRegistration numberExempt",NA,NA,NA,"['https://a0.muscache.com/im/pictures/miso/Hosting-1159053260701230398/original/d7a006a0-d94b-4e28-877e-a1c253ba2286.jpeg?im_w=720', 'https://a0.muscache.com/im/pictures/miso/Hosting-1159053260701230398/original/d622caba-1058-4b48-a04d-c9ee78b1ee41.jpeg?im_w=720', 'https://a0.muscache.com/im/pictures/miso/Hosting-1159053260701230398/original/a1927159-654f-42f8-a38c-f5e8cf1e09d2.jpeg?im_w=720', 'https://a0.muscache.com/im/pictures/miso/Hosting-1159053260701230398/original/32cd2294-80fc-41da-8930-2e2b8b965cd4.jpeg?im_w=720', 'https://a0.muscache.com/im/pictures/miso/Hosting-1159053260701230398/original/d2f87796-ca84-4be7-8abd-a83d8e3fa8a3.jpeg?im_w=720', 'https://a0.muscache.com/im/pictures/miso/Hosting-1159053260701230398/original/3e9cf466-7b85-4b8b-945c-5a25eb579465.jpeg?im_w=720', 'https://a0.muscache.com/im/pictures/miso/Hosting-1159053260701230398/original/f2173617-ecb3-4537-83db-ddbd846d46e2.jpeg?im_w=720', 'https://a0.muscache.com/im/pictures/miso/Hosting-1159053260701230398/original/925c7f4c-8f08-4503-9873-810d9f097748.jpeg?im_w=720', 'https://a0.muscache.com/im/pictures/miso/Hosting-1159053260701230398/original/f5174b06-e47b-4479-bf19-c123562a191d.jpeg?im_w=720', 'https://a0.muscache.com/im/pictures/miso/Hosting-1159053260701230398/original/b3d3ab62-923a-4e44-9659-e480bff57d84.jpeg?im_w=720', 'https://a0.muscache.com/im/pictures/miso/Hosting-1159053260701230398/original/021f0828-3d80-4fa8-b72f-fd2e1506555e.jpeg?im_w=720', 'https://a0.muscache.com/im/pictures/miso/Hosting-1159053260701230398/original/c59bd09f-8581-4ff1-92aa-883e45a8c6cd.jpeg?im_w=720']"
NA,https://www.airbnb.com/rooms/1105537822010802536?category_tag=Tag%3A8678&enable_m3_private_room=true&photo_id=1854313652&search_mode=regular_search&check_in=2024-08-05&check_out=2024-08-08&source_impression_id=p3_1722595578_P3bnqLCkcnJc2aCW&previous_page_section_name=1000&federated_search_id=66fd87c1-1986-4153-b0a4-79bd35fa6b23,NA,NA,NA,NA,NA,NA,NA,NA,NA
